{
  "metadata": {
    "schema_version": "2.0",
    "content_version": "1.0",
    "revision": 1,
    "generated_by": {
      "type": "ai",
      "provider": "deepseek",
      "model": "deepseek-chat"
    }
  },
  "episode_id": "travel_new_york_city_ep001",
  "scene_id": "S015",
  "sequence": 15,
  "location_ref": "LOC_MANHATTAN_HOTEL_001",
  "protagonist_ref": "CHAR_JIEUN_001",
  "characters": [
    {
      "character_ref": "CHAR_JIEUN_001",
      "local_character_id": null,
      "role": "protagonist",
      "gender": "female",
      "visual_state": {
        "appearance": [
          "Oval face with soft features",
          "Natural eyebrows",
          "Dark brown eyes",
          "Light natural makeup",
          "Warm friendly expression",
          "Shoulder-length dark brown hair, straight with slight natural waves, tucked behind ears"
        ],
        "clothing": [
          "White casual t-shirt",
          "Light blue denim jacket",
          "Dark blue skinny jeans",
          "White sneakers",
          "Small silver earrings",
          "Simple wristwatch"
        ],
        "carried_items": [
          "Medium-sized travel backpack",
          "Small crossbody bag",
          "Smartphone",
          "Passport",
          "Checked suitcase"
        ]
      },
      "emotion": "ready and slightly relieved to have found the hotel",
      "screen_action": "Walks along the Manhattan street checking her phone for directions, then stops at the hotel entrance and looks up at the building"
    },
    {
      "character_ref": null,
      "local_character_id": "B",
      "role": "supporting",
      "gender": "male",
      "visual_state": {
        "appearance": [
          "A local man in his 30s or 40s",
          "Friendly and approachable expression",
          "Casual urban clothing appropriate for daytime in Manhattan"
        ],
        "clothing": [
          "Casual shirt",
          "Jeans or chinos",
          "Comfortable shoes"
        ],
        "carried_items": []
      },
      "emotion": "helpful and polite",
      "screen_action": "Stops briefly to answer Jieun's question and points toward the hotel direction"
    }
  ],
  "environment": {
    "time_of_day": "day",
    "weather": null,
    "lighting": "bright natural daylight, clear and open on the Manhattan street",
    "background_activity": [
      "Pedestrians walking on the sidewalk",
      "Cars moving along the street",
      "City sounds of traffic and distant chatter"
    ]
  },
  "visual_goal": "The viewer must see Jieun successfully navigate the final stretch to her hotel, receive brief confirmation from a local, and arrive at the hotel entrance looking up at the building, ready to check in.",
  "actions": [
    {
      "sequence": 1,
      "actor_ref": "CHAR_JIEUN_001",
      "action": "Walks along the Manhattan street while looking at her smartphone for directions",
      "object_ref": "PROP_SMARTPHONE_001"
    },
    {
      "sequence": 2,
      "actor_ref": "CHAR_JIEUN_001",
      "action": "Stops a male passerby and asks if she is going the right way to the Manhattan Hotel",
      "object_ref": null
    },
    {
      "sequence": 3,
      "actor_ref": "B",
      "action": "Stops and replies that the hotel is two blocks ahead, pointing in the correct direction",
      "object_ref": null
    },
    {
      "sequence": 4,
      "actor_ref": "CHAR_JIEUN_001",
      "action": "Thanks the passerby and continues walking in the indicated direction",
      "object_ref": null
    },
    {
      "sequence": 5,
      "actor_ref": "CHAR_JIEUN_001",
      "action": "Arrives at the hotel entrance, stops, and looks up at the building",
      "object_ref": null
    }
  ],
  "props": [
    {
      "prop_id": "PROP_BACKPACK_001",
      "description": "Medium-sized travel backpack",
      "owner_ref": "CHAR_JIEUN_001",
      "continuity_required": true
    },
    {
      "prop_id": "PROP_CROSSBODY_BAG_001",
      "description": "Small crossbody bag",
      "owner_ref": "CHAR_JIEUN_001",
      "continuity_required": true
    },
    {
      "prop_id": "PROP_SMARTPHONE_001",
      "description": "Smartphone",
      "owner_ref": "CHAR_JIEUN_001",
      "continuity_required": true
    },
    {
      "prop_id": "PROP_PASSPORT_001",
      "description": "Passport",
      "owner_ref": "CHAR_JIEUN_001",
      "continuity_required": true
    },
    {
      "prop_id": "PROP_LUGGAGE_001",
      "description": "Jieun's checked suitcase that she retrieved from the carousel",
      "owner_ref": "CHAR_JIEUN_001",
      "continuity_required": true
    }
  ],
  "must_show": [
    "Jieun walking while looking at her smartphone for directions",
    "Jieun stopping to ask a male passerby for confirmation of the hotel direction",
    "The passerby pointing toward the hotel direction",
    "Jieun arriving at the hotel entrance",
    "Jieun stopping and looking up at the hotel building"
  ],
  "must_not_show": [
    "Jieun moving past the hotel entrance",
    "Any problem or difficulty in finding the hotel",
    "Jieun entering the hotel or checking in"
  ],
  "visual_continuity": {
    "carry_in": [
      "Jieun has exited the subway station and is now on the streets of Manhattan",
      "She is seeing the city skyline for the first time",
      "She feels a sense of awe and excitement",
      "She is still carrying her backpack, crossbody bag, smartphone, passport, and checked suitcase"
    ],
    "carry_out": [
      "Jieun is standing at the hotel entrance, looking up at the building",
      "She is ready to check in",
      "She is still carrying her backpack, crossbody bag, smartphone, passport, and checked suitcase"
    ],
    "start_state": [
      "Jieun is walking along a Manhattan street, looking at her smartphone for directions",
      "She is carrying her backpack, crossbody bag, smartphone, passport, and checked suitcase"
    ],
    "end_state": [
      "Jieun is standing at the entrance of the Manhattan Hotel",
      "She is looking up at the building with a ready and slightly relieved expression",
      "She is still carrying her backpack, crossbody bag, smartphone, passport, and checked suitcase"
    ]
  },
  "production_constraints": {
    "preserve_character_identity": true,
    "preserve_location_identity": true,
    "preserve_story_continuity": true,
    "allow_new_characters": false,
    "allow_new_locations": false
  }
}
